code,condition,name,desc,source,url,file,year,methodology,native,composite,mostafa_approved,,,,,,
CB,Care,Births attended by skilled health staff (% of total) [SH.STA.BRTC.ZS],"Births attended by skilled health staff are the percentage of deliveries attended by personnel trained to give the necessary supervision, care, and advice to women during pregnancy, labor, and the postpartum period; to conduct deliveries on their own; and to care for newborns.","http://data.worldbank.org ; UNICEF, State of the World's Children, Childinfo, and Demographic and Health Surveys",http://api.worldbank.org/v2/country/all/indicator/SH.STA.BRTC.ZS?format=json&per_page=16104,World-Bank Metadata,2015,"Reproductive health is a state of physical and mental well-being in relation to the reproductive system and its functions and processes. Means of achieving reproductive health include education and services during pregnancy and childbirth, safe and effective contraception, and prevention and treatment of sexually transmitted diseases. Complications of pregnancy and childbirth are the leading cause of death and disability among women of reproductive age in developing countries. The share of births attended by skilled health staff is an indicator of a health system's ability to provide adequate care for pregnant women.",1,1,1,,,,,,
CD5-D,Care,Number of under-five deaths [SH.DTH.MORT],Number of children dying before reaching age five.,http://data.worldbank.org ; UN Inter-agency Group for Child Mortality Estimation,http://api.worldbank.org/v2/country/all/indicator/SH.DTH.MORT?format=json&per_page=16104,http://collections.plos.org/s/file?id=27/Child_Mortaility_Estimation_Methods.pdf,2015,"We review how relevant data from civil registration, sample registration, population censuses, and household surveys are compiled and assessed for United Nations member states, and how time series regression models are fitted to all points of acceptable quality to establish the trends in U5MR from which infant and neonatal mortality rates are generally derived.",1,1,1,,,,,,
CDI-D,Care,Number of infant deaths [SH.DTH.IMRT],Number of infants dying before reaching one year of age.,http://data.worldbank.org ; UN Inter-agency Group for Child Mortality Estimation,http://api.worldbank.org/v2/country/all/indicator/SH.DTH.IMRT?format=json&per_page=16104,http://collections.plos.org/s/file?id=27/Child_Mortaility_Estimation_Methods.pdf,2015,"We review how relevant data from civil registration, sample registration, population censuses, and household surveys are compiled and assessed for United Nations member states, and how time series regression models are fitted to all points of acceptable quality to establish the trends in U5MR from which infant and neonatal mortality rates are generally derived.",1,1,1,,,,,,
CDM-D,Care,Number of maternal deaths [SH.MMR.DTHS],"A maternal death refers to the death of a woman while pregnant or within 42 days of termination of pregnancy, irrespective of the duration and site of the pregnancy, from any cause related to or aggravated by the pregnancy or its management but not from accidental or incidental causes.","http://data.worldbank.org ; WHO, UNICEF, UNFPA and the U.N. Population Division",http://api.worldbank.org/v2/country/all/indicator/SH.MMR.DTHS?format=json&per_page=16104,http://www.thelancet.com/pb/assets/raw/Lancet/pdfs/S0140673615008387.pdf,2015,"We updated the UN Maternal Mortality Estimation Inter-Agency Group (MMEIG) database with more than 200 additional records (vital statistics from civil registration systems, surveys, studies, or reports). We generated estimates of maternal mortality and related indicators with 80% uncertainty intervals (UIs) using a Bayesian model. The model combines the rate of change implied by a multilevel regression model with a time-series model to capture data-driven changes in country-specific MMRs, and includes a data model to adjust for systematic and random errors associated with different data sources.",1,1,1,,,,,,
CDN-D,Care,Number of neonatal deaths [SH.DTH.NMRT],Number of neonates dying before reaching 28 days of age.,http://data.worldbank.org ; UN Inter-agency Group for Child Mortality Estimation,http://api.worldbank.org/v2/country/all/indicator/SH.DTH.NMRT?format=json&per_page=16104,http://collections.plos.org/s/file?id=27/Child_Mortaility_Estimation_Methods.pdf,2015,"We review how relevant data from civil registration, sample registration, population censuses, and household surveys are compiled and assessed for United Nations member states, and how time series regression models are fitted to all points of acceptable quality to establish the trends in U5MR from which infant and neonatal mortality rates are generally derived.",1,1,1,,,,,,
CPW,Care,Pregnant women receiving prenatal care (%) [SH.STA.ANVC.ZS],Pregnant women receiving prenatal care are the percentage of women attended at least once during pregnancy by skilled health personnel for reasons related to pregnancy.,"http://data.worldbank.org ; UNICEF, State of the World's Children, Childinfo, and Demographic and Health Surveys",http://api.worldbank.org/v2/country/all/indicator/SH.STA.ANVC.ZS?format=json&per_page=16104,World-Bank Metadata,2015,"Reproductive health is a state of physical and mental well-being in relation to the reproductive system and its functions and processes. Means of achieving reproductive health include education and services during pregnancy and childbirth, safe and effective contraception, and prevention and treatment of sexually transmitted diseases. Complications of pregnancy and childbirth are the leading cause of death and disability among women of reproductive age in developing countries. Good prenatal and postnatal care improves maternal health and reduces maternal and infant mortality. However, indicators on use of antenatal care services provide no information on the content or quality of the services. Data on antenatal care are obtained mostly from household surveys, which ask women who have had a live birth whether and from whom they received antenatal care.",1,1,1,,,,,,
CST,Care,"Prevalence of stunting, height for age (% of children under 5) [SH.STA.STNT.ZS]",Prevalence of stunting is the percentage of children under age 5 whose height for age is more than two standard deviations below the median for the international reference population ages 0-59 months. For children up to two years old height is measured by recumbent length. For older children height is measured by stature while standing. The data are based on the WHO's new child growth standards released in 2006.,"http://data.worldbank.org ; WHO, Global Database on Child Growth and Malnutrition",http://api.worldbank.org/v2/country/all/indicator/SH.STA.STNT.ZS?format=json&per_page=16104,World-Bank Metadata,2014,"Malnutrition in children can be assessed by their weight for age (underweight), height for age (stunting), and by their body mass index (wasting), which is a ratio of weight to height. The proportion of underweight children is the most common malnutrition indicator. Being even mildly underweight increases the risk of death and inhibits cognitive development in children. Stunting, or being below median height for age, is often used as a proxy for multifaceted deprivation and as an indicator of long-term changes in malnutrition. Stunting refers to the percentage of children under age 5 whose height for age (stunting) is more than two standard deviations below the National Centre for Health Statistics/WHO reference median value. Estimates of child malnutrition, based on prevalence of underweight and stunting, are from national survey data. Height is measured by recumbent length for children up to two years old and by stature while standing for older children. The data are based on the WHO's new child growth standards released in 2006. Estimates of child malnutrition, based on prevalence of underweight, stunting, wasting and overweight, are from national survey data. For more information, consult the original sources. Height is measured by recumbent length for children up to two years old and by stature while standing for older children.",1,1,1,,,,,,
CTUB,Care,"Incidence of tuberculosis (per 100,000 people) [SH.TBS.INCD]","Incidence of tuberculosis is the estimated number of new and relapse tuberculosis cases arising in a given year, expressed as the rate per 100,000 population. All forms of TB are included, including cases in people living with HIV. Estimates for all years are recalculated as new information becomes available and techniques are refined, so they may differ from those published previously.",http://data.worldbank.org ; WHO,http://api.worldbank.org/v2/country/all/indicator/SH.TBS.INCD?format=json&per_page=16104,http://apps.who.int/iris/bitstream/10665/191102/1/9789241565059_eng.pdf,2014," Tuberculosis is one of the main causes of adult deaths from a single infectious agent in developing countries. In developed countries tuberculosis has reemerged largely as a result of cases among immigrants. Since tuberculosis incidence cannot be directly measured, estimates are obtained by eliciting expert opinion or are derived from measurements of prevalence or mortality.",1,1,1,,,,,,
DDENSE,Diversity,Population density (people per sq. km of land area) [EN.POP.DNST],"Population density is midyear population divided by land area in square kilometers. Population is based on the de facto definition of population, which counts all residents regardless of legal status or citizenship--except for refugees not permanently settled in the country of asylum, who are generally considered part of the population of their country of origin. Land area is a country's total area, excluding area under inland water bodies, national claims to continental shelf, and exclusive economic zones. I",http://data.worldbank.org ; Food and Agriculture Organization,http://api.worldbank.org/v2/country/all/indicator/EN.POP.DNST?format=json&per_page=16104,http://www.fao.org/docrep/018/i3107e/i3107e.PDF,2015," Population density is midyear population divided by land area in square kilometers. This ratio can be calculated for any territorial unit for any point in time, depending on the source of the population data. Populationestimates are prepared by World Bank staff from variety of sources. They are based on the de facto definition of population and include all residents regardless of legal status or citizenship, within the physical boundaries of a country and under the jurisdiction of that country's political control. Refugees not permanently settled in the country of asylum are considered part of the population of their country of origin. Population numbers are either current census data or historical census data extrapolated through demographic methods. The count also excludes visitors from overseas. Population density is calculated by dividing midyear population by land area in a country. Population is based on the de facto definition of population, which counts all residents regardless of legal status or citizenship - except for refugees not permanently settled in the country of asylum, who are generally considered part of the population of their country of origin. Land area is a country's total area, excluding area under inland water bodies, national claims to continental shelf, and exclusive economic zones. In most cases the definition of inland water bodies includes major rivers and lakes.",1,1,1,,,,,,
EGINI-I,Equivalence,GINI index (World Bank estimate) [SI.POV.GINI],"Gini index measures the extent to which the distribution of income (or, in some cases, consumption expenditure) among individuals or households within an economy deviates from a perfectly equal distribution. A Lorenz curve plots the cumulative percentages of total income received against the cumulative number of recipients, starting with the poorest individual or household. The Gini index measures the area between the Lorenz curve and a hypothetical line of absolute equality, expressed as a percentage of the ",http://data.worldbank.org,http://api.worldbank.org/v2/country/all/indicator/SI.POV.GINI?format=json&per_page=16104,World-Bank Metadata,2014,"The Gini index measures the area between the Lorenz curve and a hypothetical line of absolute equality, expressed as a percentage of the maximum area under the line. A Lorenz curve plots the cumulative percentages of total income received against the cumulative number of recipients, starting with the poorest individual. Thus a Gini index of 0 represents perfect equality, while an index of 100 implies perfect inequality. The Gini index provides a convenient summary measure of the degree of inequality. Data on the distribution of income or consumption come from nationally representative household surveys. Where the original data from the household survey were available, they have been used to calculate the income or consumption shares by quintile. Otherwise, shares have been estimated from the best available grouped data. The distribution data have been adjusted for household size, providing a more consistent measure of per capita income or consumption. No adjustment has been made for spatial differences in cost of living within countries, because the data needed for such calculations are generally unavailable. For further details on the estimation method for low- and middle-income economies, see Ravallion and Chen (1996). Survey year is the year in which the underlying household survey data were collected or, when the data collection period bridged two calendar years, the year in which most of the data were collected.",1,1,1,,,,,,
EH10-I,Equivalence,Income share held by highest 10% [SI.DST.10TH.10],Percentage share of income or consumption is the share that accrues to subgroups of population indicated by deciles or quintiles.,http://data.worldbank.org,http://api.worldbank.org/v2/country/all/indicator/SI.DST.10TH.10?format=json&per_page=16104,World-Bank Metadata,2014,"Inequality in the distribution of income is reflected in the share of income or consumption accruing to a portion of the population ranked by income or consumption levels. The portions ranked lowest by personal income receive the smallest shares of total income. Data on the distribution of income or consumption come from nationally representative household surveys. Where the original data from the household survey were available, they have been used to directly calculate the income or consumption shares by quintile. Otherwise, shares have been estimated from the best available grouped data. The distribution data have been adjusted for household size, providing a more consistent measure of per capita income or consumption. No adjustment has been made for spatial differences in cost of living within countries, because the data needed for such calculations are generally unavailable. For further details on the estimation method for low- and middle-income economies, see Ravallion and Chen (1996). Survey year is the year in which the underlying household survey data were collected or, when the data collection period bridged two calendar years, the year in which most of the data were collected. Percentage shares by quintile may not sum to 100 because of rounding.",1,1,1,,,,,,
EL10-I,Equivalence,Income share held by lowest 10% [SI.DST.FRST.10],Percentage share of income or consumption is the share that accrues to subgroups of population indicated by deciles or quintiles.,http://data.worldbank.org,http://api.worldbank.org/v2/country/all/indicator/SI.DST.FRST.10?format=json&per_page=16104,World-Bank Metadata,2014,"Inequality in the distribution of income is reflected in the share of income or consumption accruing to a portion of the population ranked by income or consumption levels. The portions ranked lowest by personal income receive the smallest shares of total income. Data on the distribution of income or consumption come from nationally representative household surveys. Where the original data from the household survey were available, they have been used to directly calculate the income or consumption shares by quintile. Otherwise, shares have been estimated from the best available grouped data. The distribution data have been adjusted for household size, providing a more consistent measure of per capita income or consumption. No adjustment has been made for spatial differences in cost of living within countries, because the data needed for such calculations are generally unavailable. For further details on the estimation method for low- and middle-income economies, see Ravallion and Chen (1996). Survey year is the year in which the underlying household survey data were collected or, when the data collection period bridged two calendar years, the year in which most of the data were collected. Percentage shares by quintile may not sum to 100 because of rounding.",1,1,1,,,,,,
PDISP,Peace,"Internally displaced persons (number, low estimate) [VC.IDP.TOTL.LE]","Internally displaced persons are people or groups of people who have been forced or obliged to flee or to leave their homes or places of habitual residence, in particular as a result of armed conflict, or to avoid the effects of armed conflict, situations of generalized violence, violations of human rights, or natural or human-made disasters and who have not crossed an international border.",http://data.worldbank.org ; Internal Displacement Monitoring Centre,http://api.worldbank.org/v2/country/all/indicator/VC.IDP.TOTL.LE?format=json&per_page=16104,World-Bank Metadata,2012, Internally displaced persons are persons or groups of persons who have been forced or obliged to flee or to leave their homes or places of habitual residence, in particular as a result of or in order to avoid the effects of armed conflict, situations of generalized violence, violations of human rights or natural or human-made disasters," and who have not crossed an internationally recognized state border."" Internally displaced people are often confused with refugees. Unlike refugees", internally displaced people remain under the protection of their own government," even if their reason for fleeing was similar to that of refugees. Refugees are people who have crossed an international border to find sanctuary and have been granted refugee or refugee-like status or temporary protection.""",1,1,1
PHOM,Peace,"Intentional homicides (per 100,000 people) [VC.IHR.PSRC.P5]","Intentional homicides are estimates of unlawful homicides purposely inflicted as a result of domestic disputes, interpersonal violence, violent conflicts over land resources, intergang violence over turf or control, and predatory violence and killing by armed groups. Intentional homicide does not include all intentional killing; the difference is usually in the organization of the killing. Individuals or small groups usually commit homicide, whereas killing in armed conflict is usually committed by fairly coh",http://data.worldbank.org ; UN Office on Drugs and Crime's International Homicide Statistics database,http://api.worldbank.org/v2/country/all/indicator/VC.IHR.PSRC.P5?format=json&per_page=16104,World-Bank Metadata,2014,"The definitions used to produce data are in line with the homicide definition used in the UNODC Homicide Statistics dataset. On the basis of these selection criteria and subject to data availability, a long and continuous time series including recent data on homicide counts and rates has been identified or created at country level. Data included in the dataset correspond to the original value provided by the source of origin, since no statistical procedure or modeling was used to change collected values or to create new or revised figures. The intentional killing of a human being by another is the ultimate crime. Its indisputable physical consequences manifested in the form of a dead body also make it the most categorical and calculable. All existing data sources on intentional homicides, both at national and international level, stem from either criminal justice or public health systems. In the former case, data are generated by law enforcement or criminal justice authorities in the process of recording and investigating a crime event. In the latter, data are produced by health authorities certifying the cause of death of an individual. Criminal justice data were collected through UNODC regular collections of crime data from Member States, through publicly available data produced by national government sources and from data compiled by other international and regional agencies, including from Interpol, Eurostat, the Organization of American States and UNICEF. Public health data on homicides were mainly derived from databases on deaths by cause disseminated by the World Health Organization (WHO). The inclusion of recent data was given a higher priority in the selection process than the length of the time series (number of years covered). An analysis of official reports and research literature is regularly carried out to verify homicide data used by government agencies and the scientific community. As a result of the data collection and validation process, in many countries several homicide datasets have become av",1,1,1,,,,,,
PR,Peace,Refugee population by country or territory of origin [SM.POP.REFG.OR],"Refugees are people who are recognized as refugees under the 1951 Convention Relating to the Status of Refugees or its 1967 Protocol, the 1969 Organization of African Unity Convention Governing the Specific Aspects of Refugee Problems in Africa, people recognized as refugees in accordance with the UNHCR statute, people granted refugee-like humanitarian status, and people provided temporary protection. Asylum seekers--people who have applied for asylum or refugee status and who have not yet received a decision",http://data.worldbank.org ; ( UNHCR ),http://api.worldbank.org/v2/country/all/indicator/SM.POP.REFG.OR?format=json&per_page=16104,World-Bank Metadata,2015,"The United Nations High Commissioner for Refugees (UNHCR) collects and maintains data on refugees in their Statistical Online Population Database. The refugee data does not include Palestinian refugees residing in areas under the mandate of the United Nations Relief and Works Agency for Palestine Refugees in the Near East (UNRWA). However, the Palestinian refugees living outside the UNRWA areas of operation do fall under the responsibility of UNHCR and are thus included in the Statistical Online Population Database. Refugees are an important part of migrant stock. The refugee data refer to people who have crossed an international border to find sanctuary and have been granted refugee or refugee-like status or temporary protection. There are three main providers of refugee data: governmental agencies, UNHCR field offices and NGOs. Registrations, together with other sources - including estimates and surveys - are the main sources of refugee data. In the absence of Government estimates, UNHCR has estimated the refugee population in most industrialized countries, based on recognition of asylum-seekers. Prior to 2007, resettled refugees were included in these estimates. Up to and including 2006, to ensure that the refugee population in countries that lack a refugee registry is reflected in the global statistics, the number of refugees was estimated by UNHCR based on the arrival of refugees through resettlement programmes and the individual recognition of refugees over a 10-year (Europe and, since 2006, the United States) or 5-year (the United States before 2006, Canada and Oceania) period. Starting with the 2007 data, the cut-off period has been harmonized and now covers a 10-year period for Europe and non-European countries. Resettled refugees, however, are excluded from the refugee estimates in all countries. The 2007-2011 refugee population category includes people in a refugee-like situation, most of who were previously included in the Others of concern group. This sub-category is descriptive in nature and includ",1,1,1,,,,,,
