code,condition,name,desc,source,url,file,year,methodology,native,composite,mostafa_approved,,,,,,
U1ALL-E,Understanding,"Survival rate to the last grade of primary education, both sexes (%) [SE.PRM.PRSL.ZS]","Percentage of a cohort of students enrolled in the first grade of primary education in a given school year who are expected to reach the last grade of primary education, regardless of repetition. Divide the total number of students belonging to a school-cohort who reached each successive grade of primary education by the number of students in the school-cohort i.e. those originally enrolled in the first grade of primary education, and multiply the result by 100. The survival rate is calculated on the basis of",http://data.worldbank.org ; UNESCO,http://api.worldbank.org/v2/country/all/indicator/SE.PRM.PRSL.ZS?format=json&per_page=16104,World-Bank Metadata,2013,"Cohort survival rate is calculated by dividing the total number of children belonging to a cohort who reached each successive grade of the specified level of education by the number of children in the same cohort; those originally enrolled in the first grade of primary education, and multiplying by 100. To reflect current patterns of grade transition, it is calculated based on the reconstructed cohort method, which uses data on enrollment by grade for the two most recent years and data on repeaters by grade for the most recent of those two years. Data on education are collected by the UNESCO Institute for Statistics from official responses to its annual education survey. All the data are mapped to the International Standard Classification of Education (ISCED) to ensure the comparability of education programs at the international level. The current version was formally adopted by UNESCO Member States in 2011. The reference years reflect the school year for which the data are presented. In some countries the school year spans two calendar years (for example, from September 2010 to June 2011); in these cases the reference year refers to the year in which the school year ended (2011 in the example).",1,1,1,,,,,,
U1TO2-E,Understanding,"Primary to secondary general education transition rate, both sexes (%) [SE.SEC.PROG.ZS]","Number of students admitted to the first grade of a higher level of education in a given year, expressed as a percentage of the number of students enrolled in the final grade of the lower level of education in the previous year. Divide the number of new entrants in the first grade of the specified higher cycle or level of education by the number of pupils who were enrolled in the final grade of the preceding cycle or level of education in the previous school year, and multiply by 100. High transition rates in",http://data.worldbank.org ; UNESCO,http://api.worldbank.org/v2/country/all/indicator/SE.SEC.PROG.ZS?format=json&per_page=16104,World-Bank Metadata,2013,"Effective transition rate is calculated by dividing the number of new entrants in the first grade of secondary education in a given year (t) by the number of students who enrolled in the final grade of primary education in the previous school year (t-1) minus the number of repeaters from the last grade of primary education in the given year (t), and multiplying by 100. Data on education are collected by the UNESCO Institute for Statistics from official responses to its annual education survey. All the data are mapped to the International Standard Classification of Education (ISCED) to ensure the comparability of education programs at the international level. The current version was formally adopted by UNESCO Member States in 2011. The reference years reflect the school year for which the data are presented. In some countries the school year spans two calendar years (for example, from September 2010 to June 2011); in these cases the reference year refers to the year in which the school year ended (2011 in the example).",1,1,1,,,,,,
UALIT-E,Understanding,"Adult literacy rate, population 15+ years, both sexes (%) [SE.ADT.LITR.ZS]","Percentage of the population age 15 and above who can, with understanding, read and write a short, simple statement on their everyday life. Generally, ?literacy? also encompasses ?numeracy?, the ability to make simple arithmetic calculations. This indicator is calculated by dividing the number of literates aged 15 years and over by the corresponding age group population and multiplying the result by 100.",http://data.worldbank.org ; UNESCO,http://api.worldbank.org/v2/country/all/indicator/SE.ADT.LITR.ZS?format=json&per_page=16104,World-Bank Metadata,2015,"Literacy statistics for most countries cover the population ages 15 and older, but some include younger ages or are confined to age ranges that tend to inflate literacy rates. The youth literacy rate for ages 15-24 reflects recent progress in education. It measures the accumulated outcomes of primary education over the previous 10 years or so by indicating the proportion of the population who have passed through the primary education system and acquired basic literacy and numeracy skills. Generally, literacy also encompasses numeracy, the ability to make simple arithmetic calculations. Data on literacy are compiled by the UNESCO Institute for Statistics based on national censuses and household surveys and, for countries without recent literacy data, using the Global Age-Specific Literacy Projection Model (GALP). For detailed information, see uis.unesco.org.",1,1,1,,,,,,
UC1-E,Understanding,"Primary completion rate, both sexes (%) [SE.PRM.CMPT.ZS]","Primary completion rate, or gross intake ratio to the last grade of primary education, is the number of new entrants (enrollments minus repeaters) in the last grade of primary education, regardless of age, divided by the population at the entrance age for the last grade of primary education. Data limitations preclude adjusting for students who drop out during the final year of primary education.",http://data.worldbank.org ; UNESCO,http://api.worldbank.org/v2/country/all/indicator/SE.PRM.CMPT.ZS?format=json&per_page=16104,World-Bank Metadata,2014,"Primary completion rate is calculated by dividing the number of new entrants (enrollment minus repeaters) in the last grade of primary education, regardless of age, by the population at the entrance age for the last grade of primary education and multiplying by 100. Data on education are collected by the UNESCO Institute for Statistics from official responses to its annual education survey. All the data are mapped to the International Standard Classification of Education (ISCED) to ensure the comparability of education programs at the international level. The current version was formally adopted by UNESCO Member States in 2011. Population data are drawn from the United Nations Population Division. Using a single source for population data standardizes definitions, estimations, and interpolation methods, ensuring a consistent methodology across countries and minimizing potential enumeration problems in national censuses. The reference years reflect the school year for which the data are presented. In some countries the school year spans two calendar years (for example, from September 2010 to June 2011); in these cases the reference year refers to the year in which the school year ended (2011 in the example).",1,1,1,,,,,,
UE1,Understanding,"Enrolment in primary education, both sexes (number) [SE.PRM.ENRL]",Total number of students enrolled in public and private primary education institutions regardless of age.,http://data.worldbank.org ; UNESCO,http://api.worldbank.org/v2/country/all/indicator/SE.PRM.ENRL?format=json&per_page=16104,World-Bank Metadata,2014,"Enrollment includes Individuals officially registered in a given educational programme, or stage or module thereof, regardless of age. Data on education are collected by the UNESCO Institute for Statistics from official responses to its annual education survey. All the data are mapped to the International Standard Classification of Education (ISCED) to ensure the comparability of education programs at the international level. The current version was formally adopted by UNESCO Member States in 2011. The reference years reflect the school year for which the data are presented. In some countries the school year spans two calendar years (for example, from September 2010 to June 2011); in these cases the reference year refers to the year in which the school year ended (2011 in the example).",1,1,1,,,,,,
UEDUG,Understanding,Expenditure on education as % of total government expenditure (%) [SE.XPD.TOTL.GB.ZS],"Total general (local, regional and central) government expenditure on education (current, capital, and transfers), expressed as a percentage of total general government expenditure on all sectors (including health, education, social services, etc.). It includes expenditure funded by transfers from international sources to government. Public education expenditure includes spending by local/municipal, regional and national governments (excluding household contributions) on educational institutions (both public ",http://data.worldbank.org ; UNESCO,http://api.worldbank.org/v2/country/all/indicator/SE.XPD.TOTL.GB.ZS?format=json&per_page=16104,World-Bank Metadata,2014,"Expenditure on education, total (% of government expenditure) is calculated by dividing total government expenditure on education by the total government expenditure on all sectors and multiplying by 100. Aggregate data are based on World Bank estimates. Data on education are collected by the UNESCO Institute for Statistics from official responses to its annual education survey. All the data are mapped to the International Standard Classification of Education (ISCED) to ensure the comparability of education programs at the international level. The current version was formally adopted by UNESCO Member States in 2011. Data on total general government expenditure were previously collected from countries through the annual questionnaire, but are from the International Monetary Fund's World Economic Outlook database since January 2014. Therefore, current data cannot be compared with data in earlier editions. The reference years reflect the school year for which the data are presented. In some countries the school year spans two calendar years (for example, from September 2010 to June 2011); in these cases the reference year refers to the year in which the school year ended (2011 in the example).",1,1,1,,,,,,
ULSC-E,Understanding,"Lower secondary completion rate, both sexes (%) [SE.SEC.CMPT.LO.ZS]","Lower secondary education completion rate is measured as the gross intake ratio to the last grade of lower secondary education (general and pre-vocational). It is calculated as the number of new entrants in the last grade of lower secondary education, regardless of age, divided by the population at the entrance age for the last grade of lower secondary education.",http://data.worldbank.org ; UNESCO,http://api.worldbank.org/v2/country/all/indicator/SE.SEC.CMPT.LO.ZS?format=json&per_page=16104,World-Bank Metadata,2014,"Lower secondary completion rate is calculated as the number of new entrants (enrollment minus repeaters) in the last grade of lower secondary education, regardless of age, divided by the population at the entrance age for the last grade of lower secondary education. Data on education are collected by the UNESCO Institute for Statistics from official responses to its annual education survey. All the data are mapped to the International Standard Classification of Education (ISCED) to ensure the comparability of education programs at the international level. The current version was formally adopted by UNESCO Member States in 2011. Population data are drawn from the United Nations Population Division. Using a single source for population data standardizes definitions, estimations, and interpolation methods, ensuring a consistent methodology across countries and minimizing potential enumeration problems in national censuses. The reference years reflect the school year for which the data are presented. In some countries the school year spans two calendar years (for example, from September 2010 to June 2011); in these cases the reference year refers to the year in which the school year ended (2011 in the example).",1,1,1,,,,,,
UNE1-E,Understanding,"Net enrolment rate, primary, both sexes (%) [SE.PRM.NENR]","Total number of students in the theoretical age group for primary education enrolled in that level, expressed as a percentage of the total population in that age group. Divide the number of students enrolled who are of the official age group for primary education by the population for the same age group and multiply the result by 100. NER at each level of education should be based on enrolment of the relevant age group in all types of schools and education institutions, including public, private and all other",http://data.worldbank.org ; UNESCO,http://api.worldbank.org/v2/country/all/indicator/SE.PRM.NENR?format=json&per_page=16104,World-Bank Metadata,2014,"Net enrollment rate for primary school is calculated by dividing the number of students of official school age enrolled in primary education by the population of the age group which officially corresponds to primary education, and multiplying by 100. Data on education are collected by the UNESCO Institute for Statistics from official responses to its annual education survey. All the data are mapped to the International Standard Classification of Education (ISCED) to ensure the comparability of education programs at the international level. The current version was formally adopted by UNESCO Member States in 2011. Population data are drawn from the United Nations Population Division. Using a single source for population data standardizes definitions, estimations, and interpolation methods, ensuring a consistent methodology across countries and minimizing potential enumeration problems in national censuses. The reference years reflect the school year for which the data are presented. In some countries the school year spans two calendar years (for example, from September 2010 to June 2011); in these cases the reference year refers to the year in which the school year ended (2011 in the example).",1,1,1,,,,,,
UNE2-E,Understanding,"Net enrolment rate, secondary, both sexes (%) [SE.SEC.NENR]","Total number of students in the theoretical age group for secondary education enrolled in that level, expressed as a percentage of the total population in that age group. Divide the number of students enrolled who are of the official age group for secondary education by the population for the same age group and multiply the result by 100. NER at each level of education should be based on enrolment of the relevant age group in all types of schools and education institutions, including public, private and all o",http://data.worldbank.org ; UNESCO,http://api.worldbank.org/v2/country/all/indicator/SE.SEC.NENR?format=json&per_page=16104,World-Bank Metadata,2014,"Net enrollment rate for secondary school is calculated by dividing the number of students of official school age enrolled in secondary education by the population of the age group which officially corresponds to secondary education, and multiplying by 100. Data on education are collected by the UNESCO Institute for Statistics from official responses to its annual education survey. All the data are mapped to the International Standard Classification of Education (ISCED) to ensure the comparability of education programs at the international level. The current version was formally adopted by UNESCO Member States in 2011. Population data are drawn from the United Nations Population Division. Using a single source for population data standardizes definitions, estimations, and interpolation methods, ensuring a consistent methodology across countries and minimizing potential enumeration problems in national censuses. The reference years reflect the school year for which the data are presented. In some countries the school year spans two calendar years (for example, from September 2010 to June 2011); in these cases the reference year refers to the year in which the school year ended (2011 in the example).",1,1,1,,,,,,
UOUT1-E,Understanding,"Out-of-school children of primary school age, both sexes (number) [SE.PRM.UNER]",Children in the official primary school age range who are not enrolled in either primary or secondary schools.,http://data.worldbank.org ; UNESCO,http://api.worldbank.org/v2/country/all/indicator/SE.PRM.UNER?format=json&per_page=16104,World-Bank Metadata,2014,"The number of out-of-school children is calculated by subtracting the number of primary school-age children enrolled in primary or secondary school from the total population of the official primary school-age children. Data on education are collected by the UNESCO Institute for Statistics from official responses to its annual education survey. All the data are mapped to the International Standard Classification of Education (ISCED) to ensure the comparability of education programs at the international level. The current version was formally adopted by UNESCO Member States in 2011. Population data are drawn from the United Nations Population Division. Using a single source for population data standardizes definitions, estimations, and interpolation methods, ensuring a consistent methodology across countries and minimizing potential enumeration problems in national censuses. The reference years reflect the school year for which the data are presented. In some countries the school year spans two calendar years (for example, from September 2010 to June 2011); in these cases the reference year refers to the year in which the school year ended (2011 in the example).",1,1,1,,,,,,
UYLIT-E,Understanding,"Youth literacy rate, population 15-24 years, both sexes (%) [SE.ADT.1524.LT.ZS]","Number of people age 15 to 24 years who can both read and write with understanding a short simple statement on their everyday life, divided by the population in that age group. Generally, ?literacy? also encompasses ?numeracy?, the ability to make simple arithmetic calculations. Divide the number of people aged 15 to 24 years who are literate by the total population in the same age group and multiply the result by 100.",http://data.worldbank.org ; UNESCO,http://api.worldbank.org/v2/country/all/indicator/SE.ADT.1524.LT.ZS?format=json&per_page=16104,World-Bank Metadata,2015,"Literacy statistics for most countries cover the population ages 15 and older, but some include younger ages or are confined to age ranges that tend to inflate literacy rates. The youth literacy rate for ages 15-24 reflects recent progress in education. It measures the accumulated outcomes of primary education over the previous 10 years or so by indicating the proportion of the population who have passed through the primary education system and acquired basic literacy and numeracy skills. Generally, literacy also encompasses numeracy, the ability to make simple arithmetic calculations. Data on literacy are compiled by the UNESCO Institute for Statistics based on national censuses and household surveys and, for countries without recent literacy data, using the Global Age-Specific Literacy Projection Model (GALP). For detailed information, see uis.unesco.org.",1,1,1,,,,,,